{
  "$schema": "https://json-schema.org/draft/2020-12/schema",
  "$id": "https://jam.local/schemas/hrgene-case.v2.schema.json",
  "title": "HRgene v4 model-visible case (generation case view v2)",
  "type": "object",
  "additionalProperties": false,
  "required": ["schemaVersion", "caseId", "language", "task", "roleContext", "jobDescriptionSourceId", "candidate", "outputSchemaVersion"],
  "properties": {
    "schemaVersion": {"const": "jam.hrgene_generation_case_view.v2"},
    "caseId": {"type": "string"},
    "language": {"enum": ["en", "zh-CN"]},
    "task": {"type": "string"},
    "roleContext": {
      "type": "object",
      "additionalProperties": false,
      "required": ["roleTitle", "jobDescription", "requirements"],
      "properties": {
        "roleTitle": {"type": "string"},
        "jobDescription": {"type": "string"},
        "requirements": {"type": "array", "minItems": 1, "items": {"type": "object", "additionalProperties": false, "required": ["requirementId", "text"], "properties": {"requirementId": {"type": "string", "pattern": "^req_[a-f0-9]{12}$"}, "text": {"type": "string"}}}}
      }
    },
    "jobDescriptionSourceId": {"type": "string", "pattern": "^jd_[a-f0-9]{16}$"},
    "candidate": {
      "type": "object",
      "additionalProperties": false,
      "required": ["candidateId", "originalCvMarkdown", "evidence"],
      "properties": {
        "candidateId": {"type": "string", "pattern": "^cand_[a-f0-9]{16}$"},
        "originalCvMarkdown": {"type": "string"},
        "evidence": {"type": "array", "minItems": 1, "items": {"type": "object", "additionalProperties": false, "required": ["sourceId", "sourceType", "text"], "properties": {"sourceId": {"type": "string", "pattern": "^src_[a-f0-9]{12}$"}, "sourceType": {"enum": ["resume", "note", "work_sample"]}, "text": {"type": "string"}}}}
      }
    },
    "outputSchemaVersion": {"const": "jam.hrgene_paired_review_bundle.model_output.v2"}
  }
}
