{
 "schemaVersion": "jam.hrgene_generation_case_view.v2",
 "caseId": "62edaa9c-232a-4b08-ab27-6b8d208c19f4",
 "language": "en",
 "task": "Generate one evidence-bounded optimized CV and one complete HiringEvidencePacket for qualified human review.",
 "roleContext": {
  "roleTitle": "Backend Engineer, Notifications Platform",
  "jobDescription": "Lumenfold sells booking software to clinics, salons and fitness studios, and its notifications platform sends confirmations and reminders by email, SMS and push. The Backend Engineer writes and maintains Go services on that platform, designs the queue consumers that carry retries, instruments services so that faults can be traced, and joins the on-call rota after onboarding. Every change reaches customers through a gated release pipeline with an approval step, and engineers watch their own releases in live operation. Engineers review each other's merge requests and hand open alerts over at a weekly meeting.",
  "requirements": [
   {
    "requirementId": "req_8e448c2c9a01",
    "text": "Builds and maintains backend services in Go with automated tests that run on every merge."
   },
   {
    "requirementId": "req_738bb4ce7983",
    "text": "Designs message-queue consumers with retry limits and dead-letter handling."
   },
   {
    "requirementId": "req_4902e585a154",
    "text": "Has released backend changes to production through a gated release pipeline and supported them in live operation."
   },
   {
    "requirementId": "req_59e8ae5532ba",
    "text": "Instruments services with structured logs and metrics and uses them to diagnose faults."
   },
   {
    "requirementId": "req_d92f28f63d58",
    "text": "Reviews colleagues' merge requests and takes part in the weekly alert handover."
   }
  ]
 },
 "jobDescriptionSourceId": "jd_6f7bfac846196b74",
 "candidate": {
  "candidateId": "cand_22ace2f1130dfebe",
  "originalCvMarkdown": "# Curriculum vitae\n\nTarget role: Backend Engineer, Notifications Platform\n\n## Experience\n\n- Software Engineer on the developer-tooling squad at Tessera Cloud, April 2022 to July 2024. Wrote and maintained three Go services behind an outbound webhook relay, with table-driven unit tests and contract tests that ran in the CI pipeline on every merge request.\n- Designed the relay's queue consumer with exponential backoff, a cap of eight delivery attempts and a dead-letter topic that support staff could browse and replay from.\n- Deployed the relay to the shared staging cluster and load-tested it at up to 2,000 messages per second; the platform team held the release pipeline and any onward rollout.\n- Reviewed merge requests for two other engineers on the squad and drafted a code-review checklist that the squad adopted in 2023.\n- Instrumented the relay with structured logs and per-endpoint request metrics, used them to trace a duplicate-delivery fault during the staging load tests, and presented open staging alerts at the squad's weekly handover.\n\n## Work samples\n\n- Work sample: a runbook titled 'Webhook relay - sandbox namespace', explaining how to start the relay in the sandbox, rotate the test signing key and replay messages from the dead-letter topic. Each page header reads 'Environment: sandbox'. The closing section, headed 'Go-live', contains a single line: 'Relay went live on 22 May for the four internal test tenants (qa-01 to qa-04).'\n",
  "evidence": [
   {
    "sourceId": "src_194d049a13ad",
    "sourceType": "resume",
    "text": "Software Engineer on the developer-tooling squad at Tessera Cloud, April 2022 to July 2024. Wrote and maintained three Go services behind an outbound webhook relay, with table-driven unit tests and contract tests that ran in the CI pipeline on every merge request."
   },
   {
    "sourceId": "src_b13d21c18805",
    "sourceType": "resume",
    "text": "Designed the relay's queue consumer with exponential backoff, a cap of eight delivery attempts and a dead-letter topic that support staff could browse and replay from."
   },
   {
    "sourceId": "src_15f3c5979f65",
    "sourceType": "resume",
    "text": "Deployed the relay to the shared staging cluster and load-tested it at up to 2,000 messages per second; the platform team held the release pipeline and any onward rollout."
   },
   {
    "sourceId": "src_c03798af5f2d",
    "sourceType": "resume",
    "text": "Reviewed merge requests for two other engineers on the squad and drafted a code-review checklist that the squad adopted in 2023."
   },
   {
    "sourceId": "src_c8be8b2ddadd",
    "sourceType": "resume",
    "text": "Instrumented the relay with structured logs and per-endpoint request metrics, used them to trace a duplicate-delivery fault during the staging load tests, and presented open staging alerts at the squad's weekly handover."
   },
   {
    "sourceId": "src_f28204846525",
    "sourceType": "work_sample",
    "text": "Work sample: a runbook titled 'Webhook relay - sandbox namespace', explaining how to start the relay in the sandbox, rotate the test signing key and replay messages from the dead-letter topic. Each page header reads 'Environment: sandbox'. The closing section, headed 'Go-live', contains a single line: 'Relay went live on 22 May for the four internal test tenants (qa-01 to qa-04).'"
   },
   {
    "sourceId": "src_adc3432a3114",
    "sourceType": "note",
    "text": "HR verification note: the employment dates (April 2022 to July 2024) and the job title Software Engineer were checked against a reference letter that Tessera Cloud's people team sent to us directly; both match the resume."
   },
   {
    "sourceId": "src_e49ada8810f9",
    "sourceType": "note",
    "text": "Recruiter logistics note: the candidate has a four-week notice period and asked whether on-call weeks carry a standby allowance."
   }
  ]
 },
 "outputSchemaVersion": "jam.hrgene_paired_review_bundle.model_output.v2"
}