{
 "schemaVersion": "jam.hrgene_generation_case_view.v2",
 "caseId": "369e9d69-0c94-499a-9a7b-62b0b8815337",
 "language": "en",
 "task": "Generate one evidence-bounded optimized CV and one complete HiringEvidencePacket for qualified human review.",
 "roleContext": {
  "roleTitle": "Supply Chain Data Scientist, Outdoor Power Equipment",
  "jobDescription": "The company assembles lawn mowers, hedge trimmers and leaf blowers in two plants and sells them through dealers and garden centres. Demand is strongly seasonal and peaks between March and June. The Supply Chain Data Scientist looks after the dealer-level replenishment model, quantifies how weather moves spring sell-through, briefs the monthly S&OP review and keeps the model code under version control with peer review. A qualified panel reads the evidence packet alongside its own interview notes, and every hiring decision rests with that panel. The data science team has three members and reports to the head of supply chain planning; models are written in Python and scheduled through the plants' planning system, and dealer-support staff use the replenishment screen every day.",
  "requirements": [
   {
    "requirementId": "req_99c8ed26045a",
    "text": "Develops and maintains a dealer-level replenishment model for seasonal products."
   },
   {
    "requirementId": "req_9632273778d6",
    "text": "Trains dealer-support staff to read the replenishment recommendations."
   },
   {
    "requirementId": "req_b185d6a4a153",
    "text": "Quantifies the effect of weather variables on spring sell-through."
   },
   {
    "requirementId": "req_9059d65f775e",
    "text": "Briefs the monthly S&OP review on demand risks and replenishment changes."
   },
   {
    "requirementId": "req_7cb433953d59",
    "text": "Keeps model code under version control with peer-reviewed merge requests."
   }
  ]
 },
 "jobDescriptionSourceId": "jd_1304b0e084861d63",
 "candidate": {
  "candidateId": "cand_ce0cfdbaeffe2f4a",
  "originalCvMarkdown": "# Curriculum vitae\n\nTarget role: Supply Chain Data Scientist, Outdoor Power Equipment\n\n## Experience\n\n- Developed the dealer-level replenishment model for 640 garden-equipment dealers at Corvane Outdoor, setting weekly order-up-to levels from sell-through, supplier lead times and dealer stock reports.\n- Added regional temperature and rainfall series to the spring sell-through model and estimated their effect with a hierarchical regression fitted on the 2019 to 2023 seasons.\n- Briefed the monthly S&OP review from September 2023 to August 2024 on demand risks and proposed changes to replenishment parameters; the review minutes record each briefing.\n- Kept all model code in the team's Git repository and opened merge requests that a second data scientist reviewed before each release to the scheduling job.\n- Ran two lunchtime sessions for the dealer-support desk on reading the replenishment screen.\n\n## Work samples\n\n- Work sample: an extract of the S&OP review minutes for March 2024 that lists the candidate as presenter of the demand-risk item, with the slide used: the mower forecast range by region, the weather assumption and a proposed safety-stock change for two dealer clusters.\n",
  "evidence": [
   {
    "sourceId": "src_23e7d6804de2",
    "sourceType": "resume",
    "text": "Developed the dealer-level replenishment model for 640 garden-equipment dealers at Corvane Outdoor, setting weekly order-up-to levels from sell-through, supplier lead times and dealer stock reports."
   },
   {
    "sourceId": "src_55ae5826b066",
    "sourceType": "resume",
    "text": "Added regional temperature and rainfall series to the spring sell-through model and estimated their effect with a hierarchical regression fitted on the 2019 to 2023 seasons."
   },
   {
    "sourceId": "src_ea5a523671a7",
    "sourceType": "resume",
    "text": "Briefed the monthly S&OP review from September 2023 to August 2024 on demand risks and proposed changes to replenishment parameters; the review minutes record each briefing."
   },
   {
    "sourceId": "src_c405cdc426a5",
    "sourceType": "resume",
    "text": "Kept all model code in the team's Git repository and opened merge requests that a second data scientist reviewed before each release to the scheduling job."
   },
   {
    "sourceId": "src_f33d2c446cce",
    "sourceType": "resume",
    "text": "Ran two lunchtime sessions for the dealer-support desk on reading the replenishment screen."
   },
   {
    "sourceId": "src_766d30592c3a",
    "sourceType": "work_sample",
    "text": "Work sample: an extract of the S&OP review minutes for March 2024 that lists the candidate as presenter of the demand-risk item, with the slide used: the mower forecast range by region, the weather assumption and a proposed safety-stock change for two dealer clusters."
   },
   {
    "sourceId": "src_671a2f923468",
    "sourceType": "note",
    "text": "HR verification note: employment at Corvane Outdoor from February 2021 to the present, job title Data Scientist, Supply Chain, checked against the employer's written confirmation of employment."
   },
   {
    "sourceId": "src_c891b9fb880b",
    "sourceType": "note",
    "text": "Recruiter logistics note: the candidate can attend the plant tour on either of the two dates offered and has a four-week notice period."
   }
  ]
 },
 "outputSchemaVersion": "jam.hrgene_paired_review_bundle.model_output.v2"
}