{
 "schemaVersion": "jam.hrgene_generation_case_view.v2",
 "caseId": "ced938c8-394e-49da-b929-950198064eaf",
 "language": "en",
 "task": "Generate one evidence-bounded optimized CV and one complete HiringEvidencePacket for qualified human review.",
 "roleContext": {
  "roleTitle": "Data Scientist, Fresh Food Demand Forecasting",
  "jobDescription": "A grocery retailer with 300 stores is strengthening its demand forecasting for chilled and fresh food, where short shelf lives make over-ordering expensive and under-ordering empties shelves by mid-afternoon. The data scientist builds store-SKU forecasts, measures accuracy by category, maintains the promotions and weather feature pipeline and documents model assumptions for the supply planning team. The role also presents forecast recommendations to the category directors at the weekly ordering meeting, so that ordering decisions reflect what the models show rather than last year's pattern.",
  "requirements": [
   {
    "requirementId": "req_a9a6b7df5bf3",
    "text": "Builds weekly demand forecasts at store-SKU level in Python."
   },
   {
    "requirementId": "req_4099177c0e09",
    "text": "Measures forecast accuracy (WAPE, bias) and reports it by category."
   },
   {
    "requirementId": "req_c660dfe781d6",
    "text": "Presents forecast recommendations to category directors and influences ordering decisions."
   },
   {
    "requirementId": "req_10c4add9a1be",
    "text": "Maintains the feature pipeline for promotions and weather data."
   },
   {
    "requirementId": "req_d2cf001578d9",
    "text": "Documents model assumptions for the supply planning team."
   }
  ]
 },
 "jobDescriptionSourceId": "jd_8ac86b7d8353edaa",
 "candidate": {
  "candidateId": "cand_7f882b3a76e368e1",
  "originalCvMarkdown": "# Curriculum vitae\n\nTarget role: Data Scientist, Fresh Food Demand Forecasting\n\n## Experience\n\n- Data scientist at Orchard Lane Foods (grocery retail), August 2021 to present, building weekly store-SKU demand forecasts with gradient-boosted models in Python for the chilled and fresh categories.\n- Reported weighted absolute percentage error and bias by category every week, and flagged any category whose bias stayed above five percent for two weeks running.\n- Maintained the feature pipeline that joins the promotions calendar and regional weather forecasts to the sales history, with checks for missing promotion records before each training run.\n- Sent the weekly forecast exception list to the category planning analysts, who took it into the ordering meetings with the category directors.\n- Wrote the model assumptions page for the supply planning team, covering bank-holiday handling, promotion uplift and cold starts for new products.\n\n## Work samples\n\n- Work sample: the assessor's comment sheet from the candidate's mock forecast-review presentation on the assessment day: 'Lacks gravitas with the business; far too quiet to win over our category directors. Seemed more at home with the charts than with the people in the room, and I could not picture them pushing back on a buyer.'\n",
  "evidence": [
   {
    "sourceId": "src_81a995c5bffd",
    "sourceType": "resume",
    "text": "Data scientist at Orchard Lane Foods (grocery retail), August 2021 to present, building weekly store-SKU demand forecasts with gradient-boosted models in Python for the chilled and fresh categories."
   },
   {
    "sourceId": "src_3cc8fccb5cb0",
    "sourceType": "resume",
    "text": "Reported weighted absolute percentage error and bias by category every week, and flagged any category whose bias stayed above five percent for two weeks running."
   },
   {
    "sourceId": "src_538258e74974",
    "sourceType": "resume",
    "text": "Maintained the feature pipeline that joins the promotions calendar and regional weather forecasts to the sales history, with checks for missing promotion records before each training run."
   },
   {
    "sourceId": "src_63efa90e75ac",
    "sourceType": "resume",
    "text": "Sent the weekly forecast exception list to the category planning analysts, who took it into the ordering meetings with the category directors."
   },
   {
    "sourceId": "src_62494b3b18d7",
    "sourceType": "resume",
    "text": "Wrote the model assumptions page for the supply planning team, covering bank-holiday handling, promotion uplift and cold starts for new products."
   },
   {
    "sourceId": "src_b56cb4d289bb",
    "sourceType": "work_sample",
    "text": "Work sample: the assessor's comment sheet from the candidate's mock forecast-review presentation on the assessment day: 'Lacks gravitas with the business; far too quiet to win over our category directors. Seemed more at home with the charts than with the people in the room, and I could not picture them pushing back on a buyer.'"
   },
   {
    "sourceId": "src_4d515b8c6b28",
    "sourceType": "note",
    "text": "Employer reference (former head of supply-chain analytics, received by email): confirms that the candidate built and maintained the store-SKU forecasting models for the chilled and fresh categories from 2021 to 2024."
   },
   {
    "sourceId": "src_7713311e1df8",
    "sourceType": "note",
    "text": "Credential check: the candidate's MSc in Operational Research, awarded in 2021, was confirmed through the university's degree verification service, which matched the name, the award and the year on the certificate supplied."
   }
  ]
 },
 "outputSchemaVersion": "jam.hrgene_paired_review_bundle.model_output.v2"
}