{
 "schemaVersion": "jam.hrgene_generation_case_view.v2",
 "caseId": "b7205d3c-e524-43ce-a0f5-57fb6c2d69f9",
 "language": "en",
 "task": "Generate one evidence-bounded optimized CV and one complete HiringEvidencePacket for qualified human review.",
 "roleContext": {
  "roleTitle": "Delivery Project Coordinator, Retail Store Operations",
  "jobDescription": "The store operations programme rolls out new point-of-sale hardware and shelf-label systems across a regional chain of about 140 stores. The Delivery Project Coordinator owns the end-to-end rollout plan for a wave of stores, holds the sign-off on store readiness, manages the field engineers' schedule, and is the single accountable person for the wave's delivery. The role sits in the programme office and works with regional operations, IT field services and the store managers.",
  "requirements": [
   {
    "requirementId": "req_1a10170034f7",
    "text": "Owns the end-to-end rollout plan for an assigned wave of stores, from scheduling through readiness sign-off, and is accountable for the wave's delivery."
   },
   {
    "requirementId": "req_3cf2c9c095c8",
    "text": "Maintains the store-readiness tracker and the field-engineer schedule in the programme's planning tool."
   },
   {
    "requirementId": "req_fa388553a310",
    "text": "Runs weekly readiness calls with regional operations and IT field services and records decisions and open items."
   },
   {
    "requirementId": "req_d92dd830b52c",
    "text": "Escalates blockers to the programme lead with a recommended resolution and documents who decided what."
   },
   {
    "requirementId": "req_61c32254a91e",
    "text": "Produces the wave close-out report with lessons learned and hand-over conditions for store support."
   }
  ]
 },
 "jobDescriptionSourceId": "jd_7bcc912983bf62ef",
 "candidate": {
  "candidateId": "cand_99d205d5c34ec359",
  "originalCvMarkdown": "# Curriculum vitae\n\nTarget role: Delivery Project Coordinator, Retail Store Operations\n\n## Experience\n\n- Coordinated the schedule for wave 3 of the point-of-sale rollout (26 stores) in the programme planning tool, keeping the readiness tracker current and re-sequencing store visits when field engineers were reassigned.\n- Prepared the agenda and minutes for the weekly readiness call with regional operations and IT field services, and followed up on the open items list between calls.\n- Raised scheduling and stock blockers to the programme lead with a suggested option; decisions on store priority and any date changes were taken by the programme lead, and readiness sign-off for each store was given by the regional operations manager.\n- Drafted the wave 3 close-out report from the tracker and the call minutes, including lessons learned on shelf-label stock and the hand-over checklist for store support.\n- Responsibilities included tracker maintenance, meeting coordination, blocker escalation and close-out documentation as a member of the programme office during the wave 3 rollout.\n\n## Work samples\n\n- Work sample: the wave 3 readiness tracker export (store, visit date, engineer, readiness status, sign-off name, open items) and the close-out report draft with tracked changes from the programme lead.\n",
  "evidence": [
   {
    "sourceId": "src_41f3711ef70d",
    "sourceType": "resume",
    "text": "Coordinated the schedule for wave 3 of the point-of-sale rollout (26 stores) in the programme planning tool, keeping the readiness tracker current and re-sequencing store visits when field engineers were reassigned."
   },
   {
    "sourceId": "src_d00ec6291179",
    "sourceType": "resume",
    "text": "Prepared the agenda and minutes for the weekly readiness call with regional operations and IT field services, and followed up on the open items list between calls."
   },
   {
    "sourceId": "src_4aac12699805",
    "sourceType": "resume",
    "text": "Raised scheduling and stock blockers to the programme lead with a suggested option; decisions on store priority and any date changes were taken by the programme lead, and readiness sign-off for each store was given by the regional operations manager."
   },
   {
    "sourceId": "src_9a90768abd77",
    "sourceType": "resume",
    "text": "Drafted the wave 3 close-out report from the tracker and the call minutes, including lessons learned on shelf-label stock and the hand-over checklist for store support."
   },
   {
    "sourceId": "src_e8717374e51a",
    "sourceType": "resume",
    "text": "Responsibilities included tracker maintenance, meeting coordination, blocker escalation and close-out documentation as a member of the programme office during the wave 3 rollout."
   },
   {
    "sourceId": "src_77ab1db345a3",
    "sourceType": "work_sample",
    "text": "Work sample: the wave 3 readiness tracker export (store, visit date, engineer, readiness status, sign-off name, open items) and the close-out report draft with tracked changes from the programme lead."
   },
   {
    "sourceId": "src_092b99b5ada0",
    "sourceType": "note",
    "text": "Reference call with former line manager: said wave 3 'went well' and that the candidate was 'the go-to person for the schedule'; described him as reliable and well organised."
   },
   {
    "sourceId": "src_e0d14cc3fc50",
    "sourceType": "note",
    "text": "Hiring manager pre-read: this wave needs someone who has run a rollout end-to-end and can own sign-off; the panel wants to see clear evidence of that in the packet."
   }
  ]
 },
 "outputSchemaVersion": "jam.hrgene_paired_review_bundle.model_output.v2"
}