{
 "schemaVersion": "jam.hrgene_generation_case_view.v2",
 "caseId": "e764685f-84fb-4e21-bf6e-da36a4be3481",
 "language": "en",
 "task": "Generate one evidence-bounded optimized CV and one complete HiringEvidencePacket for qualified human review.",
 "roleContext": {
  "roleTitle": "Frontend Engineer, Design System",
  "jobDescription": "A collaboration-software company maintains a shared design system used by six product teams and about 70 frontend engineers. The frontend engineer on the design-system team builds React and TypeScript components, audits interfaces against WCAG 2.2 AA, writes visual regression and unit tests, documents components on the design-system site and mentors junior engineers through structured code review and pairing. Two graduate engineers join the team each autumn, and each is assigned a mentor who pairs with them weekly and reviews their first components before release.",
  "requirements": [
   {
    "requirementId": "req_069fe199a000",
    "text": "Builds and maintains React components in the company design system with TypeScript."
   },
   {
    "requirementId": "req_448f61c972cc",
    "text": "Audits interfaces against WCAG 2.2 AA and fixes accessibility defects."
   },
   {
    "requirementId": "req_4dee8a3298fd",
    "text": "Mentors junior engineers through structured code review and pairing."
   },
   {
    "requirementId": "req_65084da3dd5c",
    "text": "Writes visual regression and unit tests for components."
   },
   {
    "requirementId": "req_08ff212aadf5",
    "text": "Writes component documentation on the design-system site."
   }
  ]
 },
 "jobDescriptionSourceId": "jd_c1c9b2366b049130",
 "candidate": {
  "candidateId": "cand_8a314f54f7e66a20",
  "originalCvMarkdown": "# Curriculum vitae\n\nTarget role: Frontend Engineer, Design System\n\n## Experience\n\n- Frontend engineer at Quillstack (project-management software), May 2021 to present, building React and TypeScript components for the company's design system, including the date picker, data table and toast notifications.\n- Audited the checkout and account-settings flows against WCAG 2.2 AA and fixed 37 defects, including focus order, colour contrast and form error announcements.\n- Added visual regression tests for 60 design-system components and unit tests for keyboard interaction on every interactive component.\n- Wrote usage guidance, do-and-don't examples and prop tables for the design-system documentation site, and added a keyboard-interaction section to each interactive component's page.\n- Reviewed pull requests from other frontend engineers on the design-system repository as one of four code owners.\n\n## Work samples\n\n- Work sample: the pairing-session facilitator's feedback form from the candidate's mock pairing session at the assessment centre: 'A natural mentor with infectious energy; our juniors would love learning from them. Warm, patient manner, and clearly someone who enjoys explaining things to people newer to the craft.'\n",
  "evidence": [
   {
    "sourceId": "src_88bbb518ed46",
    "sourceType": "resume",
    "text": "Frontend engineer at Quillstack (project-management software), May 2021 to present, building React and TypeScript components for the company's design system, including the date picker, data table and toast notifications."
   },
   {
    "sourceId": "src_bb231457551d",
    "sourceType": "resume",
    "text": "Audited the checkout and account-settings flows against WCAG 2.2 AA and fixed 37 defects, including focus order, colour contrast and form error announcements."
   },
   {
    "sourceId": "src_eadc56596b4e",
    "sourceType": "resume",
    "text": "Added visual regression tests for 60 design-system components and unit tests for keyboard interaction on every interactive component."
   },
   {
    "sourceId": "src_f2d1a2a3255a",
    "sourceType": "resume",
    "text": "Wrote usage guidance, do-and-don't examples and prop tables for the design-system documentation site, and added a keyboard-interaction section to each interactive component's page."
   },
   {
    "sourceId": "src_bf809823bc05",
    "sourceType": "resume",
    "text": "Reviewed pull requests from other frontend engineers on the design-system repository as one of four code owners."
   },
   {
    "sourceId": "src_4743bcd942f2",
    "sourceType": "work_sample",
    "text": "Work sample: the pairing-session facilitator's feedback form from the candidate's mock pairing session at the assessment centre: 'A natural mentor with infectious energy; our juniors would love learning from them. Warm, patient manner, and clearly someone who enjoys explaining things to people newer to the craft.'"
   },
   {
    "sourceId": "src_2971daff7ac0",
    "sourceType": "note",
    "text": "Reference check summary: the former engineering manager confirmed in writing that the candidate carried out the WCAG 2.2 AA audit of the checkout and account-settings flows in 2023 and fixed the defects it found."
   },
   {
    "sourceId": "src_0828d4a182c8",
    "sourceType": "note",
    "text": "HR verification note: employment at Quillstack since May 2021 and the job title Frontend Engineer were confirmed in writing by the employer's HR team."
   }
  ]
 },
 "outputSchemaVersion": "jam.hrgene_paired_review_bundle.model_output.v2"
}