{
 "schemaVersion": "jam.hrgene_generation_case_view.v2",
 "caseId": "bf365a53-21d2-4fbb-88f8-9916354a1c6b",
 "language": "en",
 "task": "Generate one evidence-bounded optimized CV and one complete HiringEvidencePacket for qualified human review.",
 "roleContext": {
  "roleTitle": "Predictive Maintenance Engineer, Wind Turbine Fleet Analytics",
  "jobDescription": "The wind turbine fleet analytics service predicts component failures for an operator's turbines and raises work orders for the maintenance crews. The Predictive Maintenance Engineer operates the failure models in production: has deployed models into the live scoring service, watches live alert precision against confirmed failures, handles production model incidents such as a sensor feed dropping out, coordinates model releases with the platform team, and documents each model's limitations. The role reports to the head of fleet analytics and works with the platform team, the maintenance planners and the site crews.",
  "requirements": [
   {
    "requirementId": "req_7c220b04f4b7",
    "text": "Has deployed failure models into the live scoring service and watches live alert precision against confirmed failures."
   },
   {
    "requirementId": "req_7001d5010fc5",
    "text": "Handles production model incidents such as a sensor feed dropping out during the scoring window."
   },
   {
    "requirementId": "req_942626d6f5bc",
    "text": "Coordinates model releases with the platform team and records own responsibility boundaries."
   },
   {
    "requirementId": "req_a37552b94a6c",
    "text": "Builds and backtests failure models on historical sensor and work-order data under a documented evaluation protocol."
   },
   {
    "requirementId": "req_c24a1a8cb402",
    "text": "Documents each model's limitations and hand-over conditions in a model card."
   }
  ]
 },
 "jobDescriptionSourceId": "jd_838773543c567700",
 "candidate": {
  "candidateId": "cand_2d610a2b81884925",
  "originalCvMarkdown": "# Curriculum vitae\n\nTarget role: Predictive Maintenance Engineer, Wind Turbine Fleet Analytics\n\n## Experience\n\n- Deployed four gearbox and bearing failure models into the live scoring service of the fleet analytics platform over three years, releasing each through the platform team's release pipeline under my own release tickets.\n- Watched live alert precision against confirmed failures in the weekly review with the maintenance planners, and handled the production model incidents in that period, including two sensor feed drop-outs, with incident records in the platform incident log.\n- Built and backtested each model on the historical sensor and work-order data under the evaluation protocol agreed with the planners before proposing it for release.\n- Coordinated model releases with the platform team in the release review, recording in the release ticket which checks were mine and which belonged to the platform team.\n- Wrote the model card for each model, listing the training data window, the backtest results, the known limitations for turbines without vibration sensors and the hand-over conditions.\n\n## Work samples\n\n- Work sample: the release tickets for the four models, the weekly precision review for the last quarter and the incident records for the two sensor feed drop-outs, with the platform incident log identifiers as a verification trail.\n",
  "evidence": [
   {
    "sourceId": "src_bbd795e6fdae",
    "sourceType": "resume",
    "text": "Deployed four gearbox and bearing failure models into the live scoring service of the fleet analytics platform over three years, releasing each through the platform team's release pipeline under my own release tickets."
   },
   {
    "sourceId": "src_142b77c79acc",
    "sourceType": "resume",
    "text": "Watched live alert precision against confirmed failures in the weekly review with the maintenance planners, and handled the production model incidents in that period, including two sensor feed drop-outs, with incident records in the platform incident log."
   },
   {
    "sourceId": "src_fdede1e29daf",
    "sourceType": "resume",
    "text": "Built and backtested each model on the historical sensor and work-order data under the evaluation protocol agreed with the planners before proposing it for release."
   },
   {
    "sourceId": "src_94179080c6e8",
    "sourceType": "resume",
    "text": "Coordinated model releases with the platform team in the release review, recording in the release ticket which checks were mine and which belonged to the platform team."
   },
   {
    "sourceId": "src_6cbd112fa085",
    "sourceType": "resume",
    "text": "Wrote the model card for each model, listing the training data window, the backtest results, the known limitations for turbines without vibration sensors and the hand-over conditions."
   },
   {
    "sourceId": "src_95582ab44bf2",
    "sourceType": "work_sample",
    "text": "Work sample: the release tickets for the four models, the weekly precision review for the last quarter and the incident records for the two sensor feed drop-outs, with the platform incident log identifiers as a verification trail."
   },
   {
    "sourceId": "src_594ec6c7ffa0",
    "sourceType": "note",
    "text": "Recruiter screen: candidate said he 'deployed the failure models to the live scoring service' and 'watched the alerts every week'; asked about incidents, he described the two sensor feed drop-outs and their incident records, which match the resume."
   },
   {
    "sourceId": "src_f5297e4916ee",
    "sourceType": "note",
    "text": "Hiring manager pre-read: the head of fleet analytics wants the packet to show the release tickets and the incident records with dates, and to keep any offline backtesting separate from the live scoring work."
   }
  ]
 },
 "outputSchemaVersion": "jam.hrgene_paired_review_bundle.model_output.v2"
}