{
 "schemaVersion": "jam.hrgene_generation_case_view.v2",
 "caseId": "980e494c-45aa-4e74-ba4d-1b51cf8d1740",
 "language": "en",
 "task": "Generate one evidence-bounded optimized CV and one complete HiringEvidencePacket for qualified human review.",
 "roleContext": {
  "roleTitle": "Pricing Analyst, Motor Insurance",
  "jobDescription": "The motor insurance pricing team sets the rates behind the insurer's motor quotes. The Pricing Analyst refreshes the rating factors from the claims and quote data, prepares the rate change proposals with their impact analysis, runs the pricing model monitoring, prepares the monthly pricing pack for the pricing committee, and documents each proposal's limitations. Rate changes are approved by the pricing committee. Reports to the head of motor pricing; works with the actuarial team, the underwriting team and the data platform team.",
  "requirements": [
   {
    "requirementId": "req_2c474ae6991b",
    "text": "Refreshes rating factors from claims and quote data under the pricing team's refresh procedure."
   },
   {
    "requirementId": "req_e85b335c3da3",
    "text": "Prepares rate change proposals with impact analysis, with approval staying with the pricing committee."
   },
   {
    "requirementId": "req_b964581a1e90",
    "text": "Runs the pricing model monitoring and raises drift to the actuarial team."
   },
   {
    "requirementId": "req_ec207c97a3d3",
    "text": "Prepares the monthly pricing pack for the pricing committee and records own responsibility boundaries."
   },
   {
    "requirementId": "req_eadb5ecd5aa2",
    "text": "Documents each proposal's limitations and hand-over conditions."
   }
  ]
 },
 "jobDescriptionSourceId": "jd_5a4d4b2d6ba5cba3",
 "candidate": {
  "candidateId": "cand_5f3a83ae90404e0f",
  "originalCvMarkdown": "# Curriculum vitae\n\nTarget role: Pricing Analyst, Motor Insurance\n\n## Experience\n\n- Pricing analyst in the motor pricing team of a personal lines insurer for three years, refreshing the rating factors from the claims and quote data each quarter under the team's refresh procedure.\n- Prepared eleven rate change proposals with their impact analysis; each was approved or amended by the pricing committee, with the committee's decision recorded on the proposal.\n- Ran the pricing model monitoring each month and raised three drift cases to the actuarial team, recorded in the monitoring log.\n- Prepared the monthly pricing pack for the pricing committee, recording in the pack which analyses were mine and which came from the actuarial team.\n- Wrote the limitation section and the hand-over conditions of each rate change proposal.\n\n## Work samples\n\n- Work sample: one rate change proposal with its impact analysis and the committee decision record, one monthly pricing pack and the monitoring log extract for the three drift cases, with the pricing repository references as a verification trail.\n",
  "evidence": [
   {
    "sourceId": "src_8b0b14f5cb81",
    "sourceType": "resume",
    "text": "Pricing analyst in the motor pricing team of a personal lines insurer for three years, refreshing the rating factors from the claims and quote data each quarter under the team's refresh procedure."
   },
   {
    "sourceId": "src_b532d3a9d282",
    "sourceType": "resume",
    "text": "Prepared eleven rate change proposals with their impact analysis; each was approved or amended by the pricing committee, with the committee's decision recorded on the proposal."
   },
   {
    "sourceId": "src_6612e358e029",
    "sourceType": "resume",
    "text": "Ran the pricing model monitoring each month and raised three drift cases to the actuarial team, recorded in the monitoring log."
   },
   {
    "sourceId": "src_23a20cd6f64c",
    "sourceType": "resume",
    "text": "Prepared the monthly pricing pack for the pricing committee, recording in the pack which analyses were mine and which came from the actuarial team."
   },
   {
    "sourceId": "src_8b7c54c16e3e",
    "sourceType": "resume",
    "text": "Wrote the limitation section and the hand-over conditions of each rate change proposal."
   },
   {
    "sourceId": "src_c4784db81405",
    "sourceType": "work_sample",
    "text": "Work sample: one rate change proposal with its impact analysis and the committee decision record, one monthly pricing pack and the monitoring log extract for the three drift cases, with the pricing repository references as a verification trail."
   },
   {
    "sourceId": "src_7b5669c209fe",
    "sourceType": "note",
    "text": "Reference call with the former head of motor pricing: confirmed the candidate prepared the proposals and the packs in the period, with the rate decisions taken by the committee, and confirmed the employment dates."
   },
   {
    "sourceId": "src_173a9408d7dc",
    "sourceType": "note",
    "text": "Recruiter logistics note: candidate is available for the technical exercise on either of the two proposed dates and has no relocation or travel constraints for the role."
   }
  ]
 },
 "outputSchemaVersion": "jam.hrgene_paired_review_bundle.model_output.v2"
}