{
 "schemaVersion": "jam.hrgene_generation_case_view.v2",
 "caseId": "51dce696-aa17-4f52-ae1f-c80609db8228",
 "language": "en",
 "task": "Generate one evidence-bounded optimized CV and one complete HiringEvidencePacket for qualified human review.",
 "roleContext": {
  "roleTitle": "Senior Treasury Operations Analyst, Liquidity Reporting",
  "jobDescription": "The liquidity reporting team produces the bank's daily liquidity position and the regulatory liquidity returns. The Senior Treasury Operations Analyst is the senior analyst of record on the daily position: signs the daily liquidity pack before it goes to the treasurer, supervises the two associate analysts who prepare it, owns the return reconciliation with finance, and documents the pack's boundaries. The team requires prior experience as the senior analyst signing a daily liquidity or funding pack, together with the treasury certification the bank's operations policy names. Reports to the head of liquidity reporting; works with the treasurer's office, finance and the regulatory reporting team.",
  "requirements": [
   {
    "requirementId": "req_cfa6de394723",
    "text": "Has been the senior analyst of record signing a daily liquidity or funding pack."
   },
   {
    "requirementId": "req_fd24aade2a5f",
    "text": "Holds the treasury certification named in the bank's operations policy."
   },
   {
    "requirementId": "req_8e693a005591",
    "text": "Supervises the associate analysts who prepare the daily pack."
   },
   {
    "requirementId": "req_6e4dc24034e8",
    "text": "Reconciles the regulatory liquidity returns with finance under a documented reconciliation procedure."
   },
   {
    "requirementId": "req_8be97227e2c0",
    "text": "Documents the daily pack's boundaries and open items for the treasurer."
   }
  ]
 },
 "jobDescriptionSourceId": "jd_810995a9c81ef5da",
 "candidate": {
  "candidateId": "cand_dcd03a7dc033c412",
  "originalCvMarkdown": "# Curriculum vitae\n\nTarget role: Senior Treasury Operations Analyst, Liquidity Reporting\n\n## Experience\n\n- Senior Treasury Operations Analyst at a regional bank for three years, the senior analyst of record signing the daily liquidity pack before it went to the treasurer, after two years as an associate analyst preparing the same pack.\n- Certified Treasury Professional since 2023; certificate number and the association's registry entry available on request.\n- Supervised the two associate analysts who prepared the daily pack, running their preparation checklist and the four-eyes review before signing.\n- Reconciled the regulatory liquidity returns with finance each month under the bank's reconciliation procedure, with the reconciliation workbooks filed in the treasury folder.\n- Wrote the daily pack's boundary note and the open items list for the treasurer, updated after each month-end and each procedure change.\n\n## Work samples\n\n- Work sample: one signed daily liquidity pack with the boundary note and open items list, one monthly reconciliation workbook and the certification certificate, with the treasury folder references as a verification trail.\n",
  "evidence": [
   {
    "sourceId": "src_fd2d03358367",
    "sourceType": "resume",
    "text": "Senior Treasury Operations Analyst at a regional bank for three years, the senior analyst of record signing the daily liquidity pack before it went to the treasurer, after two years as an associate analyst preparing the same pack."
   },
   {
    "sourceId": "src_b2422fec4d54",
    "sourceType": "resume",
    "text": "Certified Treasury Professional since 2023; certificate number and the association's registry entry available on request."
   },
   {
    "sourceId": "src_d02ac04016f2",
    "sourceType": "resume",
    "text": "Supervised the two associate analysts who prepared the daily pack, running their preparation checklist and the four-eyes review before signing."
   },
   {
    "sourceId": "src_16f66bbc9e39",
    "sourceType": "resume",
    "text": "Reconciled the regulatory liquidity returns with finance each month under the bank's reconciliation procedure, with the reconciliation workbooks filed in the treasury folder."
   },
   {
    "sourceId": "src_9c94bd89d51f",
    "sourceType": "resume",
    "text": "Wrote the daily pack's boundary note and the open items list for the treasurer, updated after each month-end and each procedure change."
   },
   {
    "sourceId": "src_c1bb8c002850",
    "sourceType": "work_sample",
    "text": "Work sample: one signed daily liquidity pack with the boundary note and open items list, one monthly reconciliation workbook and the certification certificate, with the treasury folder references as a verification trail."
   },
   {
    "sourceId": "src_265b2f7749d3",
    "sourceType": "note",
    "text": "Recruiter screen: candidate said she signs the daily pack as senior analyst and holds the Certified Treasury Professional credential; she named the two associates she supervises and the year of certification, which match the resume."
   },
   {
    "sourceId": "src_870daeb2c043",
    "sourceType": "note",
    "text": "Hiring manager pre-read: the head of liquidity reporting asks the packet to cite the signed pack and the certificate, and to show the associate years separately from the senior analyst years."
   }
  ]
 },
 "outputSchemaVersion": "jam.hrgene_paired_review_bundle.model_output.v2"
}