{
 "schemaVersion": "jam.hrgene_generation_case_view.v2",
 "caseId": "662f4438-bf86-4442-8402-1894bad366c7",
 "language": "en",
 "task": "Generate one evidence-bounded optimized CV and one complete HiringEvidencePacket for qualified human review.",
 "roleContext": {
  "roleTitle": "Product Owner, Mobile Payments",
  "jobDescription": "A regional credit union is rebuilding the payments area of its mobile app, starting with adding a new payee and the name check that runs before a first payment. The Product Owner manages the payments squad's backlog, writes user stories with input from the compliance officer, runs sprint reviews and usability sessions with members, and reports funnel results from the app analytics tool. Funnel results are reported as before-and-after comparisons with defined periods and event definitions from the tracking plan.",
  "requirements": [
   {
    "requirementId": "req_b8f9678066fc",
    "text": "Manages and refines the backlog for a mobile payments squad."
   },
   {
    "requirementId": "req_52443dfa0111",
    "text": "Writes user stories and acceptance criteria that incorporate compliance requirements."
   },
   {
    "requirementId": "req_0a2831fecb37",
    "text": "Shows a measured improvement in a payments journey funnel against a defined baseline period."
   },
   {
    "requirementId": "req_2733464a2dd6",
    "text": "Runs sprint reviews and usability sessions with customers or members."
   },
   {
    "requirementId": "req_41b7f54d0c61",
    "text": "Has worked with confirmation-of-payee or an equivalent name-checking service, including the handling of close-match results."
   }
  ]
 },
 "jobDescriptionSourceId": "jd_703eceb2e1378dc1",
 "candidate": {
  "candidateId": "cand_8138fb47cbcb2dc2",
  "originalCvMarkdown": "# Curriculum vitae\n\nTarget role: Product Owner, Mobile Payments\n\n## Experience\n\n- Managed the backlog for the payments squad of Thistle Credit Union's mobile app, refining stories each week with the four engineers and the tester.\n- Wrote the user stories for the new add-payee journey with the compliance officer, including acceptance criteria for the warning shown when a payee name does not match the account.\n- After the add-payee journey was rebuilt, the share of add-payee attempts abandoned before confirmation fell from 23.5% (January to March 2024) to 12.9% (May to July 2024), measured with the analytics events defined in the tracking plan.\n- Ran fortnightly sprint reviews and three moderated usability sessions with members recruited through the member panel.\n- Worked with the integration partner to connect the name-checking service and to test its match and no-match responses before the April 2024 release.\n\n## Work samples\n\n- Work sample: the add-payee funnel report from the app analytics tool, showing weekly abandonment from January to July 2024 with the April release marked, the event definitions from the tracking plan and the period averages of 23.5% before and 12.9% after the release.\n",
  "evidence": [
   {
    "sourceId": "src_3114fb43079e",
    "sourceType": "resume",
    "text": "Managed the backlog for the payments squad of Thistle Credit Union's mobile app, refining stories each week with the four engineers and the tester."
   },
   {
    "sourceId": "src_6d562f060220",
    "sourceType": "resume",
    "text": "Wrote the user stories for the new add-payee journey with the compliance officer, including acceptance criteria for the warning shown when a payee name does not match the account."
   },
   {
    "sourceId": "src_d0e1ababbc08",
    "sourceType": "resume",
    "text": "After the add-payee journey was rebuilt, the share of add-payee attempts abandoned before confirmation fell from 23.5% (January to March 2024) to 12.9% (May to July 2024), measured with the analytics events defined in the tracking plan."
   },
   {
    "sourceId": "src_e32c2ebaf8a3",
    "sourceType": "resume",
    "text": "Ran fortnightly sprint reviews and three moderated usability sessions with members recruited through the member panel."
   },
   {
    "sourceId": "src_a10d83d7da26",
    "sourceType": "resume",
    "text": "Worked with the integration partner to connect the name-checking service and to test its match and no-match responses before the April 2024 release."
   },
   {
    "sourceId": "src_58eb35bcec21",
    "sourceType": "work_sample",
    "text": "Work sample: the add-payee funnel report from the app analytics tool, showing weekly abandonment from January to July 2024 with the April release marked, the event definitions from the tracking plan and the period averages of 23.5% before and 12.9% after the release."
   },
   {
    "sourceId": "src_724e647f45b8",
    "sourceType": "note",
    "text": "HR verification note: the candidate's dates at Thistle Credit Union (June 2022 to the present) and job title Product Owner, Payments were confirmed in a letter from the credit union's HR manager."
   },
   {
    "sourceId": "src_faa825a4e318",
    "sourceType": "note",
    "text": "Reference check summary: the credit union's head of digital confirmed by email that the candidate managed the payments squad's backlog throughout the add-payee rebuild."
   }
  ]
 },
 "outputSchemaVersion": "jam.hrgene_paired_review_bundle.model_output.v2"
}