{
 "schemaVersion": "jam.hrgene_generation_case_view.v2",
 "caseId": "6bd8ad6c-06f5-4422-9f19-16e5c009f623",
 "language": "en",
 "task": "Generate one evidence-bounded optimized CV and one complete HiringEvidencePacket for qualified human review.",
 "roleContext": {
  "roleTitle": "Finance Operations Analyst, Credit Workflow System",
  "jobDescription": "The credit workflow system at a commercial bank routes loan applications through underwriting, approval and disbursement. The Finance Operations Analyst owns the disbursement reconciliation control, leads the month-end reconciliation close for the credit book, approves reconciliation adjustments within a delegated limit, and reports control results to the finance controller.",
  "requirements": [
   {
    "requirementId": "req_37adec57f6a3",
    "text": "Owns the disbursement reconciliation control and leads the month-end reconciliation close for the credit book."
   },
   {
    "requirementId": "req_d6ef5ab49598",
    "text": "Approves reconciliation adjustments within a delegated limit and escalates larger ones to the finance controller."
   },
   {
    "requirementId": "req_5f84b45b943b",
    "text": "Maintains the reconciliation procedure and the control evidence pack."
   },
   {
    "requirementId": "req_09060abc6a26",
    "text": "Coordinates the close timetable with treasury and the credit operations team and records own responsibility boundaries."
   },
   {
    "requirementId": "req_2fbe10ac9191",
    "text": "Documents known limitations and hand-over conditions at each month-end."
   }
  ]
 },
 "jobDescriptionSourceId": "jd_26968a6b4e01da72",
 "candidate": {
  "candidateId": "cand_dbf4b6af856bc584",
  "originalCvMarkdown": "# Curriculum vitae\n\nTarget role: Finance Operations Analyst, Credit Workflow System\n\n## Experience\n\n- Led the month-end disbursement reconciliation close for the credit book at a commercial bank for twenty-two months, as the named control owner in the finance control register, running the close timetable and signing the close-out checklist.\n- Held a delegated approval limit of 25,000 for reconciliation adjustments, approving adjustments within the limit in the reconciliation tool under my own user id and escalating larger ones to the finance controller with a proposed treatment.\n- Maintained the reconciliation procedure and assembled the control evidence pack each month for internal audit, including the adjustment log, the sign-off record and the break ageing report.\n- Agreed the close timetable each month with treasury and the credit operations team, recording in the close plan that treasury owned the funding entries and credit operations owned the disbursement queue.\n- Responsibilities included control ownership, adjustment approvals within limit, procedure maintenance and evidence packs for the disbursement reconciliation over about two years.\n\n## Work samples\n\n- Work sample: the control register entry naming the candidate as control owner, one month's signed close-out checklist and the adjustment log showing approvals under the candidate's user id, with the reconciliation tool's record identifiers as a verification trail.\n",
  "evidence": [
   {
    "sourceId": "src_b849b961d8cc",
    "sourceType": "resume",
    "text": "Led the month-end disbursement reconciliation close for the credit book at a commercial bank for twenty-two months, as the named control owner in the finance control register, running the close timetable and signing the close-out checklist."
   },
   {
    "sourceId": "src_1f1a7cfba40a",
    "sourceType": "resume",
    "text": "Held a delegated approval limit of 25,000 for reconciliation adjustments, approving adjustments within the limit in the reconciliation tool under my own user id and escalating larger ones to the finance controller with a proposed treatment."
   },
   {
    "sourceId": "src_01c945bb43f9",
    "sourceType": "resume",
    "text": "Maintained the reconciliation procedure and assembled the control evidence pack each month for internal audit, including the adjustment log, the sign-off record and the break ageing report."
   },
   {
    "sourceId": "src_5b945802bfce",
    "sourceType": "resume",
    "text": "Agreed the close timetable each month with treasury and the credit operations team, recording in the close plan that treasury owned the funding entries and credit operations owned the disbursement queue."
   },
   {
    "sourceId": "src_a0075b98346a",
    "sourceType": "resume",
    "text": "Responsibilities included control ownership, adjustment approvals within limit, procedure maintenance and evidence packs for the disbursement reconciliation over about two years."
   },
   {
    "sourceId": "src_b1f13194989a",
    "sourceType": "work_sample",
    "text": "Work sample: the control register entry naming the candidate as control owner, one month's signed close-out checklist and the adjustment log showing approvals under the candidate's user id, with the reconciliation tool's record identifiers as a verification trail."
   },
   {
    "sourceId": "src_6525e34ae946",
    "sourceType": "note",
    "text": "Reference call with the former finance controller: confirmed the candidate was the registered control owner, held the 25,000 delegated limit and led the month-end close; confirmed employment dates."
   },
   {
    "sourceId": "src_023b5af6863b",
    "sourceType": "note",
    "text": "Recruiter logistics note: candidate has a one-month notice period and is available for an on-site control walkthrough."
   }
  ]
 },
 "outputSchemaVersion": "jam.hrgene_paired_review_bundle.model_output.v2"
}